weather_condition,common_symptoms,otc_recommendations,herbal_recommendations,avoid_or_warning,notes
Panas ekstrem,"Sakit kepala ringan, lelah, pusing, mual ringan",Paracetamol; Oralit; Minuman elektrolit,Air kelapa; Teh daun mint; Infused water timun,Hindari NSAID berlebihan; kafein tinggi,"Gunakan hanya untuk keluhan ringan. Jika gejala berlanjut atau berat, jangan lupa ke dokter."
Musim hujan / lembap,"Pilek, batuk ringan, demam ringan, pegal",Paracetamol; Obat batuk OTC; Antihistamin non-sedatif,Jahe hangat; Madu; Teh lemon,Hindari antibiotik tanpa resep,"Perhatikan alergi obat. Jika tidak membaik dalam beberapa hari, konsultasi ke dokter."
Cuaca dingin / berangin,"Hidung tersumbat, bersin, tenggorokan gatal",Antihistamin; Obat flu OTC,Wedang jahe; Teh chamomile; Kayu manis hangat,Waspadai obat yang menyebabkan kantuk,"Gunakan sesuai kebutuhan. Jika muncul sesak atau demam tinggi, ke dokter."
Paparan UV tinggi,"Kulit kemerahan ringan, iritasi, kering",Calamine lotion; Pelembap kulit,Gel lidah buaya; Minyak kelapa,Hindari paparan matahari berlebihan,"Jika iritasi berat atau melepuh, segera konsultasi ke dokter."
Perubahan cuaca ekstrem,"Flu ringan, badan tidak enak, nyeri sendi ringan",Paracetamol; Obat flu OTC,Kunyit hangat; Temulawak; Madu,Hindari aktivitas berat berlebihan,"Pantau kondisi tubuh. Jika gejala menetap, jangan lupa ke dokter."
Kualitas udara buruk / berasap,"Batuk ringan, mata perih, tenggorokan kering",Obat batuk OTC; Tetes mata lubrikan,Madu; Teh jahe; Air hangat,Hindari aktivitas luar ruangan lama,"Jika batuk berat atau sesak napas, segera ke dokter."
